url/_source,url/_text,url,pageUrl
/doi/full/10.1080/09644016.2015.1008682,Marina Silva and the rise of sustainability in Brazil,http://www.tandfonline.com/doi/full/10.1080/09644016.2015.1008682,http://www.tandfonline.com/action/doSearch?SeriesKey=fenp20&content=standard&countTerms=true&dateRange=%5B20140101+TO+*%7D&target=default&sortBy=&pageSize=50&subjectTitle=&startPage=3
/doi/full/10.1080/09644016.2015.976468,"The sustainable economics of Elinor Ostrom: commons, contestation and craft",http://www.tandfonline.com/doi/full/10.1080/09644016.2015.976468,http://www.tandfonline.com/action/doSearch?SeriesKey=fenp20&content=standard&countTerms=true&dateRange=%5B20140101+TO+*%7D&target=default&sortBy=&pageSize=50&subjectTitle=&startPage=3
/doi/full/10.1080/09644016.2015.976472,"Loving nature, fearing the state: environmentalism and antigovernment politics before Reagan",http://www.tandfonline.com/doi/full/10.1080/09644016.2015.976472,http://www.tandfonline.com/action/doSearch?SeriesKey=fenp20&content=standard&countTerms=true&dateRange=%5B20140101+TO+*%7D&target=default&sortBy=&pageSize=50&subjectTitle=&startPage=3
/doi/full/10.1080/09644016.2015.976478,"Energy, governance and security in Thailand and Myanmar (Burma): a critical approach to environmental politics in the South",http://www.tandfonline.com/doi/full/10.1080/09644016.2015.976478,http://www.tandfonline.com/action/doSearch?SeriesKey=fenp20&content=standard&countTerms=true&dateRange=%5B20140101+TO+*%7D&target=default&sortBy=&pageSize=50&subjectTitle=&startPage=3
/doi/full/10.1080/09644016.2015.976480,Community gardening as social action,http://www.tandfonline.com/doi/full/10.1080/09644016.2015.976480,http://www.tandfonline.com/action/doSearch?SeriesKey=fenp20&content=standard&countTerms=true&dateRange=%5B20140101+TO+*%7D&target=default&sortBy=&pageSize=50&subjectTitle=&startPage=4
/doi/full/10.1080/09644016.2014.919748,The green economy agenda: business as usual or transformational discourse?,http://www.tandfonline.com/doi/full/10.1080/09644016.2014.919748,http://www.tandfonline.com/action/doSearch?SeriesKey=fenp20&content=standard&countTerms=true&dateRange=%5B20140101+TO+*%7D&target=default&sortBy=&pageSize=50&subjectTitle=&startPage=4
/doi/full/10.1080/09644016.2015.976460,The Greens in the 2014 European elections,http://www.tandfonline.com/doi/full/10.1080/09644016.2015.976460,http://www.tandfonline.com/action/doSearch?SeriesKey=fenp20&content=standard&countTerms=true&dateRange=%5B20140101+TO+*%7D&target=default&sortBy=&pageSize=50&subjectTitle=&startPage=4
/doi/full/10.1080/09644016.2014.954776,Biofuel sustainability and the formation of transnational hybrid governance,http://www.tandfonline.com/doi/full/10.1080/09644016.2014.954776,http://www.tandfonline.com/action/doSearch?SeriesKey=fenp20&content=standard&countTerms=true&dateRange=%5B20140101+TO+*%7D&target=default&sortBy=&pageSize=50&subjectTitle=&startPage=4
/doi/full/10.1080/09644016.2015.976470,Engaged environmental citizenship,http://www.tandfonline.com/doi/full/10.1080/09644016.2015.976470,http://www.tandfonline.com/action/doSearch?SeriesKey=fenp20&content=standard&countTerms=true&dateRange=%5B20140101+TO+*%7D&target=default&sortBy=&pageSize=50&subjectTitle=&startPage=4
/doi/full/10.1080/09644016.2014.927190,The politics of European agencements: constructing a market of sustainable biofuels,http://www.tandfonline.com/doi/full/10.1080/09644016.2014.927190,http://www.tandfonline.com/action/doSearch?SeriesKey=fenp20&content=standard&countTerms=true&dateRange=%5B20140101+TO+*%7D&target=default&sortBy=&pageSize=50&subjectTitle=&startPage=4
/doi/full/10.1080/09644016.2014.959247,"‘I’m not a tree hugger, I’m just like you’: changing perceptions of sustainable lifestyles",http://www.tandfonline.com/doi/full/10.1080/09644016.2014.959247,http://www.tandfonline.com/action/doSearch?SeriesKey=fenp20&content=standard&countTerms=true&dateRange=%5B20140101+TO+*%7D&target=default&sortBy=&pageSize=50&subjectTitle=&startPage=4
/doi/full/10.1080/09644016.2014.921453,Wielding the green stick: criminal enforcement at the EPA under the Bush and Obama administrations,http://www.tandfonline.com/doi/full/10.1080/09644016.2014.921453,http://www.tandfonline.com/action/doSearch?SeriesKey=fenp20&content=standard&countTerms=true&dateRange=%5B20140101+TO+*%7D&target=default&sortBy=&pageSize=50&subjectTitle=&startPage=4
/doi/full/10.1080/09644016.2014.961273,Reason and rhetoric in climate communication,http://www.tandfonline.com/doi/full/10.1080/09644016.2014.961273,http://www.tandfonline.com/action/doSearch?SeriesKey=fenp20&content=standard&countTerms=true&dateRange=%5B20140101+TO+*%7D&target=default&sortBy=&pageSize=50&subjectTitle=&startPage=4
/doi/full/10.1080/09644016.2014.955680,The global network of biofuel sustainability standards-setters,http://www.tandfonline.com/doi/full/10.1080/09644016.2014.955680,http://www.tandfonline.com/action/doSearch?SeriesKey=fenp20&content=standard&countTerms=true&dateRange=%5B20140101+TO+*%7D&target=default&sortBy=&pageSize=50&subjectTitle=&startPage=4
/doi/full/10.1080/09644016.2014.954770,Policy instruments and the remediation and redevelopment of contaminated properties,http://www.tandfonline.com/doi/full/10.1080/09644016.2014.954770,http://www.tandfonline.com/action/doSearch?SeriesKey=fenp20&content=standard&countTerms=true&dateRange=%5B20140101+TO+*%7D&target=default&sortBy=&pageSize=50&subjectTitle=&startPage=4
/doi/full/10.1080/09644016.2014.1000636,The electoral performance of the Belgian Green parties in 2014,http://www.tandfonline.com/doi/full/10.1080/09644016.2014.1000636,http://www.tandfonline.com/action/doSearch?SeriesKey=fenp20&content=standard&countTerms=true&dateRange=%5B20140101+TO+*%7D&target=default&sortBy=&pageSize=50&subjectTitle=&startPage=4
/doi/full/10.1080/09644016.2014.1000638,Ecological modernisation of a ‘Cinderella renewable’? The emerging politics of global ocean energy,http://www.tandfonline.com/doi/full/10.1080/09644016.2014.1000638,http://www.tandfonline.com/action/doSearch?SeriesKey=fenp20&content=standard&countTerms=true&dateRange=%5B20140101+TO+*%7D&target=default&sortBy=&pageSize=50&subjectTitle=&startPage=4
/doi/full/10.1080/09644016.2015.1008252,Green political theory in a climate-changed world: between innovation and restraint,http://www.tandfonline.com/doi/full/10.1080/09644016.2015.1008252,http://www.tandfonline.com/action/doSearch?SeriesKey=fenp20&content=standard&countTerms=true&dateRange=%5B20140101+TO+*%7D&target=default&sortBy=&pageSize=50&subjectTitle=&startPage=4
/doi/full/10.1080/09644016.2014.919749,"Internet, citizen self-mobilisation, and social movement organisations in environmental collective action campaigns: two Hong Kong cases",http://www.tandfonline.com/doi/full/10.1080/09644016.2014.919749,http://www.tandfonline.com/action/doSearch?SeriesKey=fenp20&content=standard&countTerms=true&dateRange=%5B20140101+TO+*%7D&target=default&sortBy=&pageSize=50&subjectTitle=&startPage=4
/doi/full/10.1080/09644016.2014.1000639,‘We are not the Wild West’: anti-fracking protests in Romania,http://www.tandfonline.com/doi/full/10.1080/09644016.2014.1000639,http://www.tandfonline.com/action/doSearch?SeriesKey=fenp20&content=standard&countTerms=true&dateRange=%5B20140101+TO+*%7D&target=default&sortBy=&pageSize=50&subjectTitle=&startPage=4
/doi/full/10.1080/09644016.2015.976465,How do policy entrepreneurs influence policy change? Framing and boundary work in EU transport biofuels policy,http://www.tandfonline.com/doi/full/10.1080/09644016.2015.976465,http://www.tandfonline.com/action/doSearch?SeriesKey=fenp20&content=standard&countTerms=true&dateRange=%5B20140101+TO+*%7D&target=default&sortBy=&pageSize=50&subjectTitle=&startPage=4
/doi/full/10.1080/09644016.2015.992600,"Climate change advocacy online: theories of change, target audiences, and online strategy",http://www.tandfonline.com/doi/full/10.1080/09644016.2015.992600,http://www.tandfonline.com/action/doSearch?SeriesKey=fenp20&content=standard&countTerms=true&dateRange=%5B20140101+TO+*%7D&target=default&sortBy=&pageSize=50&subjectTitle=&startPage=4
/doi/full/10.1080/09644016.2014.973222,Party differences and energy reform: fiscal conservatism in the California legislature,http://www.tandfonline.com/doi/full/10.1080/09644016.2014.973222,http://www.tandfonline.com/action/doSearch?SeriesKey=fenp20&content=standard&countTerms=true&dateRange=%5B20140101+TO+*%7D&target=default&sortBy=&pageSize=50&subjectTitle=&startPage=4
/doi/full/10.1080/09644016.2014.976485,A four-party view of US environmental concern,http://www.tandfonline.com/doi/full/10.1080/09644016.2014.976485,http://www.tandfonline.com/action/doSearch?SeriesKey=fenp20&content=standard&countTerms=true&dateRange=%5B20140101+TO+*%7D&target=default&sortBy=&pageSize=50&subjectTitle=&startPage=4
/doi/full/10.1080/09644016.2014.1000635,The Swedish Greens: a big step forward – and several steps back,http://www.tandfonline.com/doi/full/10.1080/09644016.2014.1000635,http://www.tandfonline.com/action/doSearch?SeriesKey=fenp20&content=standard&countTerms=true&dateRange=%5B20140101+TO+*%7D&target=default&sortBy=&pageSize=50&subjectTitle=&startPage=4
/doi/full/10.1080/09644016.2014.1000637,Can politics still be different? The Hungarian Green party’s return to parliament in 2014,http://www.tandfonline.com/doi/full/10.1080/09644016.2014.1000637,http://www.tandfonline.com/action/doSearch?SeriesKey=fenp20&content=standard&countTerms=true&dateRange=%5B20140101+TO+*%7D&target=default&sortBy=&pageSize=50&subjectTitle=&startPage=4
/doi/full/10.1080/09644016.2015.1023577,Environmental concerns during a time of duress: an introduction,http://www.tandfonline.com/doi/full/10.1080/09644016.2015.1023577,http://www.tandfonline.com/action/doSearch?SeriesKey=fenp20&content=standard&countTerms=true&dateRange=%5B20140101+TO+*%7D&target=default&sortBy=&pageSize=50&subjectTitle=&startPage=4
/doi/full/10.1080/09644016.2015.1023576,Waxing or waning? The changing patterns of environmental activism,http://www.tandfonline.com/doi/full/10.1080/09644016.2015.1023576,http://www.tandfonline.com/action/doSearch?SeriesKey=fenp20&content=standard&countTerms=true&dateRange=%5B20140101+TO+*%7D&target=default&sortBy=&pageSize=50&subjectTitle=&startPage=4
/doi/full/10.1080/09644016.2015.1023578,Faith that science will solve environmental problems: does it hurt or help?,http://www.tandfonline.com/doi/full/10.1080/09644016.2015.1023578,http://www.tandfonline.com/action/doSearch?SeriesKey=fenp20&content=standard&countTerms=true&dateRange=%5B20140101+TO+*%7D&target=default&sortBy=&pageSize=50&subjectTitle=&startPage=4
/doi/full/10.1080/09644016.2015.1023574,"Economic development, environmental justice, and pro-environmental behavior",http://www.tandfonline.com/doi/full/10.1080/09644016.2015.1023574,http://www.tandfonline.com/action/doSearch?SeriesKey=fenp20&content=standard&countTerms=true&dateRange=%5B20140101+TO+*%7D&target=default&sortBy=&pageSize=50&subjectTitle=&startPage=4
/doi/full/10.1080/09644016.2015.1023579,Representation through parties? Environmental attitudes and party stances in Europe in 2013,http://www.tandfonline.com/doi/full/10.1080/09644016.2015.1023579,http://www.tandfonline.com/action/doSearch?SeriesKey=fenp20&content=standard&countTerms=true&dateRange=%5B20140101+TO+*%7D&target=default&sortBy=&pageSize=50&subjectTitle=&startPage=4
/doi/full/10.1080/09644016.2015.1023575,Attitudes towards the environment: are post-Communist societies (still) different?,http://www.tandfonline.com/doi/full/10.1080/09644016.2015.1023575,http://www.tandfonline.com/action/doSearch?SeriesKey=fenp20&content=standard&countTerms=true&dateRange=%5B20140101+TO+*%7D&target=default&sortBy=&pageSize=50&subjectTitle=&startPage=4
/doi/full/10.1080/09644016.2016.1232522,Assessing diversity and inclusivity within the Transition movement: an urban case study,http://www.tandfonline.com/doi/full/10.1080/09644016.2016.1232522,http://www.tandfonline.com/action/doSearch?SeriesKey=fenp20&content=standard&countTerms=true&dateRange=%5B20140101+TO+*%7D&target=default&sortBy=&pageSize=50&subjectTitle=&startPage=4
/doi/full/10.1080/09644016.2016.1219026,The Tea Party versus Agenda 21: local groups and sustainability policies in U.S. cities,http://www.tandfonline.com/doi/full/10.1080/09644016.2016.1219026,http://www.tandfonline.com/action/doSearch?SeriesKey=fenp20&content=standard&countTerms=true&dateRange=%5B20140101+TO+*%7D&target=default&sortBy=&pageSize=50&subjectTitle=&startPage=4
/doi/full/10.1080/09644016.2016.1223189,Vetoing the future: political constraints and renewable energy,http://www.tandfonline.com/doi/full/10.1080/09644016.2016.1223189,http://www.tandfonline.com/action/doSearch?SeriesKey=fenp20&content=standard&countTerms=true&dateRange=%5B20140101+TO+*%7D&target=default&sortBy=&pageSize=50&subjectTitle=&startPage=4
/doi/full/10.1080/09644016.2016.1218630,The EU effect: does trade with the EU reduce CO2 emissions in the developing world?,http://www.tandfonline.com/doi/full/10.1080/09644016.2016.1218630,http://www.tandfonline.com/action/doSearch?SeriesKey=fenp20&content=standard&countTerms=true&dateRange=%5B20140101+TO+*%7D&target=default&sortBy=&pageSize=50&subjectTitle=&startPage=4
/doi/full/10.1080/09644016.2016.1223190,"Weather, climate, politics, or God? Determinants of American public opinions toward global warming",http://www.tandfonline.com/doi/full/10.1080/09644016.2016.1223190,http://www.tandfonline.com/action/doSearch?SeriesKey=fenp20&content=standard&countTerms=true&dateRange=%5B20140101+TO+*%7D&target=default&sortBy=&pageSize=50&subjectTitle=&startPage=4
